[
  {
    "rule": "AGENTS#3",
    "severity": "critical",
    "source": "deterministic:pii_flow",
    "file": "app/archive.py",
    "message": "Personal data (`student.full_name`) reaches a copy stored in a module-level collection in plain text.",
    "suggestion": "Store `student_id` instead of personal fields, and declare the dataset's category in `RETENTION_DAYS`.",
    "line": 15,
    "check": "P2"
  },
  {
    "rule": "AGENTS#3",
    "severity": "high",
    "source": "deterministic:retention",
    "file": "app/archive.py",
    "message": "New dataset (module-level collection `ARCHIVE`) without a retention category in `RETENTION_DAYS`.",
    "suggestion": "Declare it in app/privacy.py, e.g. `\"archive\": 365, \"archive_minor\": 90`, and document its purpose.",
    "line": 8,
    "check": "A4"
  },
  {
    "rule": "AGENTS#6",
    "severity": "high",
    "source": "deterministic:change_policy",
    "file": "app/archive.py",
    "message": "Service code changed (app/archive.py, app/main.py) but no test under `tests/` was added or updated (this also covers the changed-line coverage gap).",
    "suggestion": "Add tests that fail if this behavior breaks, including edge cases (refactors too: prove nothing changed).",
    "line": null,
    "check": "A9"
  },
  {
    "rule": "AGENTS#20",
    "severity": "medium",
    "source": "deterministic:change_policy",
    "file": "app/archive.py",
    "message": "Service code changed but `docs/ARCHITECTURE.md`, `docs/API-AND-BUSINESS-RULES.md` were not updated.",
    "suggestion": "Update the docs in the same PR: modules/diagrams/flows in ARCHITECTURE.md; endpoints, business rules and known gaps in API-AND-BUSINESS-RULES.md.",
    "line": null,
    "check": "A14"
  },
  {
    "rule": "AGENTS#18",
    "severity": "low",
    "source": "deterministic:change_policy",
    "file": "DECISIONS.md",
    "message": "`DECISIONS.md` is missing.",
    "suggestion": "Record it in `DECISIONS.md`: decisions and trade-offs in DECISIONS.md, AI tools/prompts/corrections in AI-USAGE.md.",
    "line": null,
    "check": "A16"
  },
  {
    "rule": "AGENTS#18",
    "severity": "low",
    "source": "deterministic:change_policy",
    "file": "AI-USAGE.md",
    "message": "`AI-USAGE.md` is missing.",
    "suggestion": "Record it in `AI-USAGE.md`: decisions and trade-offs in DECISIONS.md, AI tools/prompts/corrections in AI-USAGE.md.",
    "line": null,
    "check": "A16"
  }
]