[
  {
    "rule": "AGENTS#4",
    "severity": "critical",
    "source": "ai:gemini",
    "file": "app/support.py",
    "message": "Collecting personal data (full name, email, birthdate) for support context violates data minimization when student_id suffices. In this service, students may be minors.",
    "suggestion": "def build_support_context(student, records):\n    return {\n        \"student_id\": student.id,\n        \"records\": len(records),\n    }",
    "line": 4,
    "check": "B6"
  }
]