[
  {
    "rule": "AGENTS#1",
    "severity": "critical",
    "source": "deterministic:pii_flow",
    "file": "app/main.py",
    "message": "Personal data (`student.full_name`) reaches a log/print call in plain text.",
    "suggestion": "Log only pseudonymous ids: `logger.info(\"...\", redact({...}))` or log `student.id`.",
    "line": 59,
    "check": "P2"
  },
  {
    "rule": "AGENTS#6",
    "severity": "high",
    "source": "deterministic:change_policy",
    "file": "app/main.py",
    "message": "Service code changed (app/main.py) but no test under `tests/` was added or updated.",
    "suggestion": "Add tests that fail if this behavior breaks, including edge cases (refactors too: prove nothing changed).",
    "line": null,
    "check": "A9"
  },
  {
    "rule": "AGENTS#20",
    "severity": "high",
    "source": "deterministic:change_policy",
    "file": "app/main.py",
    "message": "Service code changed but `docs/ARCHITECTURE.md`, `docs/API-AND-BUSINESS-RULES.md` were not updated.",
    "suggestion": "Update the docs in the same PR: modules/diagrams/flows in ARCHITECTURE.md; endpoints, business rules and known gaps in API-AND-BUSINESS-RULES.md.",
    "line": null,
    "check": "A14"
  },
  {
    "rule": "AGENTS#18",
    "severity": "low",
    "source": "deterministic:change_policy",
    "file": "DECISIONS.md",
    "message": "`DECISIONS.md` is missing.",
    "suggestion": "Record it in `DECISIONS.md`: decisions and trade-offs in DECISIONS.md, AI tools/prompts/corrections in AI-USAGE.md.",
    "line": null,
    "check": "A16"
  },
  {
    "rule": "AGENTS#18",
    "severity": "low",
    "source": "deterministic:change_policy",
    "file": "AI-USAGE.md",
    "message": "`AI-USAGE.md` is missing.",
    "suggestion": "Record it in `AI-USAGE.md`: decisions and trade-offs in DECISIONS.md, AI tools/prompts/corrections in AI-USAGE.md.",
    "line": null,
    "check": "A16"
  }
]