[
  {
    "rule": "AGENTS#5",
    "severity": "medium",
    "source": "ai:gemini",
    "file": "app/main.py",
    "message": "Passing a non-numeric score in payload causes an unhandled ValueError and returns a 500 instead of a 4xx. Input conversion must be validated explicitly. Pre-existing: this line already exists on the base branch and the PR only moves it, so it doesn't block. Fix it here if it's cheap, otherwise open a ticket.",
    "suggestion": "try:\n    score = int(payload.get(\"score\", 0))\nexcept (TypeError, ValueError):\n    raise HTTPException(status_code=422, detail=\"score must be an integer\")",
    "line": 52,
    "check": "B7"
  },
  {
    "rule": "AGENTS#6",
    "severity": "medium",
    "source": "ai:gemini",
    "file": "tests/test_score_validation.py",
    "message": "test_valid_score_accepted does not assert the HTTP status code (200), and tests do not cover non-integer score inputs.",
    "suggestion": "def test_valid_score_accepted():\n    resp = client.post(\"/students/s-004/progress\", json={\"lesson_id\": \"l-02\", \"score\": 100})\n    assert resp.status_code == 200\n    assert resp.json() == {\"ok\": True}",
    "line": 18,
    "check": "B8"
  }
]