[
  {
    "rule": "AGENTS#9",
    "severity": "high",
    "source": "ai:gemini",
    "file": "app/main.py",
    "message": "When total lessons is 0, progress percentage defaults to 100 instead of 0. This reports unearned completion to students when no lessons exist.",
    "suggestion": "percentage = round(100 * completed / total) if total else 0",
    "line": 38,
    "check": "B11"
  }
]