[
  {
    "rule": "AGENTS#6",
    "severity": "high",
    "source": "ai:gemini",
    "file": "tests/test_streaks.py",
    "message": "Tests use weak assertions (`isinstance`, `>= 0`) that cannot fail even if streak calculation logic is completely broken.",
    "suggestion": "def test_streak_consecutive_days():\n    today = date(2026, 7, 22)\n    dates = [date(2026, 7, 21), date(2026, 7, 20)]\n    assert current_streak(dates, today=today) == 2\n    assert current_streak([], today=today) == 0",
    "line": 6,
    "check": "B8"
  },
  {
    "rule": "AGENTS#9",
    "severity": "high",
    "source": "ai:gemini",
    "file": "app/streaks.py",
    "message": "`current_streak` starts checking at `today - timedelta(days=1)`, ignoring activity done on `today` despite the docstring stating it counts consecutive days ending today.",
    "suggestion": "day = today if today in days else today - timedelta(days=1)\nwhile day in days:\n    streak += 1\n    day -= timedelta(days=1)\nreturn streak",
    "line": 10,
    "check": "B11"
  }
]